{
  "schema": "wodin/wod@1",
  "workoutId": "athlete-a-2026-09-15",
  "date": "2026-09-15",
  "athleteTitle": "Athlete A's WOD",
  "title": "Engine + Grip",
  "program": "Base Build · Week 3 of 6",
  "estDuration": "~40 min",
  "targetRpe": 8,
  "coach": "Coach Rivera",
  "coachNote": "Conditioning day. Intervals are the session — everything after is accessory, so don't let the swings eat the rowing. Hold the split on all four pieces; if piece 3 drifts more than 3s, cut piece 4 and call it. Metric loads today.",
  "units": {
    "load": "kg",
    "distance": "m"
  },
  "sections": [
    {
      "id": "warmup",
      "name": "Warm-up",
      "type": "warmup",
      "exercises": [
        {
          "id": "ex1",
          "movement": "Row",
          "kind": "cardio",
          "tag": "Engine",
          "cue": "Nose-breathing pace. Long chain, no rush on the recovery.",
          "sets": [
            {
              "id": "s1",
              "distance": 500,
              "pace": "2:20/500m",
              "duration": null,
              "athleteFills": "duration"
            }
          ]
        },
        {
          "id": "ex2",
          "movement": "World's greatest stretch",
          "kind": "time",
          "tag": "Mobility",
          "cue": "Hips / t-spine — hold each position, don't bounce through it.",
          "sets": [
            {
              "id": "s1",
              "duration": "1:00"
            },
            {
              "id": "s2",
              "duration": "1:00"
            }
          ]
        },
        {
          "id": "ex3",
          "movement": "Banded good morning",
          "kind": "reps",
          "tag": "Activation",
          "cue": "Posterior chain — push the hips back; spine stays long.",
          "sets": [
            {
              "id": "s1",
              "reps": 15
            },
            {
              "id": "s2",
              "reps": 15
            }
          ]
        }
      ]
    },
    {
      "id": "intervals",
      "name": "Intervals",
      "type": "conditioning",
      "exercises": [
        {
          "id": "ex4",
          "movement": "Row",
          "kind": "cardio",
          "tag": "Engine",
          "cue": "Target split is the whole point — log the time you actually held.",
          "sets": [
            {
              "id": "s1",
              "distance": 500,
              "pace": "1:55/500m",
              "duration": null,
              "athleteFills": "duration",
              "rest": "2:00"
            },
            {
              "id": "s2",
              "distance": 500,
              "pace": "1:55/500m",
              "duration": null,
              "athleteFills": "duration",
              "rest": "2:00"
            },
            {
              "id": "s3",
              "distance": 500,
              "pace": "1:55/500m",
              "duration": null,
              "athleteFills": "duration",
              "rest": "2:00"
            },
            {
              "id": "s4",
              "distance": 500,
              "pace": "1:55/500m",
              "duration": null,
              "athleteFills": "duration"
            }
          ]
        }
      ]
    },
    {
      "id": "strength",
      "name": "Strength",
      "type": "strength",
      "exercises": [
        {
          "id": "ex5",
          "movement": "Kettlebell swing",
          "kind": "weight_reps",
          "tag": "Power",
          "cue": "Hinge, not squat. Snap the hips; arms are ropes.",
          "sets": [
            {
              "id": "s1",
              "reps": 15,
              "load": 24
            },
            {
              "id": "s2",
              "reps": 15,
              "load": 24
            },
            {
              "id": "s3",
              "reps": 15,
              "load": 24
            }
          ]
        },
        {
          "id": "ex6",
          "movement": "Goblet squat",
          "kind": "weight_reps",
          "tag": "Work set",
          "cue": "Elbows inside the knees at the bottom; chest tall.",
          "sets": [
            {
              "id": "s1",
              "reps": 12,
              "load": 24
            },
            {
              "id": "s2",
              "reps": 12,
              "load": 24
            },
            {
              "id": "s3",
              "reps": 12,
              "load": 24
            }
          ]
        },
        {
          "id": "ex7",
          "movement": "Hollow hold",
          "kind": "time",
          "tag": "Core",
          "cue": "Lower back pinned to the floor. Shorten the lever if it lifts.",
          "sets": [
            {
              "id": "s1",
              "duration": "0:40"
            },
            {
              "id": "s2",
              "duration": "0:40"
            }
          ]
        }
      ]
    },
    {
      "id": "finisher",
      "name": "Finisher",
      "type": "carry",
      "exercises": [
        {
          "id": "ex8",
          "movement": "Farmer carry",
          "kind": "carry",
          "tag": "Strongman / grip",
          "cue": "Grip / traps — tall posture, short steps, crush the handles. Put them down before the grip fails, not after.",
          "sets": [
            {
              "id": "s1",
              "load": 24,
              "reps": 2,
              "distance": 40
            },
            {
              "id": "s2",
              "load": 24,
              "reps": 2,
              "distance": 40
            }
          ]
        }
      ]
    }
  ]
}
