{
  "schema": "wodin/wod@1",
  "workoutId": "2026-10-08",
  "date": "2026-10-08",
  "athleteTitle": "Brian's WOD",
  "title": "12-Minute AMRAP Triplet",
  "program": "Conditioning",
  "coach": "Gainz",
  "coachNote": "Pace it like you could hold it for all 12 — negative split if anything. Ring rows scale your pulling without a bar; keep the body in a hard plank.",
  "targetRpe": 8,
  "units": {
    "load": "lb",
    "distance": "m"
  },
  "sink": {
    "type": "post",
    "url": "https://wod.imav8n.com/api/log"
  },
  "sections": [
    {
      "id": "metcon",
      "name": "Triplet",
      "type": "conditioning",
      "scheme": {
        "kind": "amrap",
        "cap": "12:00"
      },
      "exercises": [
        {
          "movement": "Row",
          "kind": "cardio",
          "tag": "Steady",
          "cue": "Easy-work pace so you can keep cycling.",
          "sets": [
            {
              "distance": 250,
              "pace": "2:20/500m",
              "duration": null,
              "athleteFills": "duration"
            }
          ]
        },
        {
          "movement": "Ring row",
          "kind": "reps",
          "tag": "Horizontal pull",
          "cue": "Hard-plank body at 45°; chest to the rings. Walk the feet back to make it easier as you fatigue.",
          "sets": [
            {
              "reps": 12,
              "loadType": "bodyweight"
            }
          ]
        },
        {
          "movement": "Sit-up",
          "kind": "reps",
          "tag": "Abmat",
          "cue": "Full range, hands to heels.",
          "sets": [
            {
              "reps": 15,
              "loadType": "bodyweight"
            }
          ]
        }
      ]
    }
  ]
}
